index,Job Title,Salary Estimate,Job Description,Rating,Company Name,Location,Headquarters,Size,Founded,Type of ownership,Industry,Sector,Revenue,Competitors,Hourly,Employer provided,Lower Salary,Upper Salary,Avg Salary(K),company_txt,Job Location,Age,Python,spark,aws,excel,sql,sas,keras,pytorch,scikit,tensor,hadoop,tableau,bi,flink,mongo,google_an,job_title_sim,seniority_by_title,Degree
691,Senior Insurance Data Scientist,$107K-$173K (Glassdoor est.),What We'll Bring: At TransUnion- we have a welcoming and energetic environment that encourages coll...,3.9,TransUnion 3.9,Chicago- IL,Chicago- IL,5001 - 10000,1968,Company - Public,Financial Analytics & Research,Finance,$1 to $2 billion (USD),-1,0,0,107,173,140.0,TransUnion,IL,53,1,0,0,1,1,1,0,0,0,0,0,0,0,0,0,0,data scientist,sr,na
692,Senior Data Science Systems Engineer,$56K-$99K (Glassdoor est.),MITRE’s Army Concepts- Platforms and Theater Operations Department (P622) is seeking a highly motiva...,3.2,MITRE 3.2,Hampton- VA,Bedford- MA,5001 - 10000,1958,Nonprofit Organization,Federal Agencies,Government,$1 to $2 billion (USD),Battelle- General Atomics- SAIC,0,0,56,99,77.5,MITRE,VA,63,0,0,0,0,0,0,0,0,0,0,0,0,0,0,0,0,data scientist,sr,P
694,ENVIRONMENTAL ENGINEER/SCIENTIST,Employer Provided Salary:$25-$28 Per Hour,McPhail Associates- LLC is a geotechnical and geoenvironmental engineering consulting firm located i...,3.3,Mcphail Associates 3.3,Cambridge- MA,Cambridge- MA,1 - 50,1976,Company - Private,Construction,Construction- Repair & Maintenance,Unknown / Non-Applicable,-1,1,1,52,58,55.0,Mcphail Associates,MA,45,0,0,0,1,0,0,0,0,0,0,0,0,0,0,0,0,other scientist,na,na
695,Senior Scientist - Regulatory Submissions,$80K-$155K (Glassdoor est.),British American Tobacco Reynolds American Incorporated is positively transforming the tobacco indus...,3.1,Reynolds American 3.1,Winston-Salem- NC,Winston-Salem- NC,5001 - 10000,1875,Company - Private,Consumer Products Manufacturing,Manufacturing,$10+ billion (USD),-1,0,0,80,155,117.5,Reynolds American,NC,146,0,0,0,1,0,0,0,0,0,0,0,0,0,0,0,0,other scientist,sr,M
696,Scientist - Biomarker and Flow Cytometry,$43K-$98K (Glassdoor est.),Crown Bioscience- a JSR Life Sciences company- is seeking a highly motivated and skilled PhD level s...,2.4,Crown Bioscience 2.4,San Diego- CA,San Diego- CA,501 - 1000,2006,Company - Private,Biotech & Pharmaceuticals,Biotech & Pharmaceuticals,$50 to $100 million (USD),-1,0,0,43,98,70.5,Crown Bioscience,CA,15,0,0,0,0,0,0,0,0,0,0,0,0,0,0,0,0,other scientist,na,M
697,Associate Scientist- LC/MS Biologics,$44K-$96K (Glassdoor est.),Q2 Solutions is a leading clinical trial laboratory services organization with end-to-end laboratory...,2.9,Q2 Solutions 2.9,Ithaca- NY,Morrisville- NC,1001 - 5000,2015,Company - Private,Biotech & Pharmaceuticals,Biotech & Pharmaceuticals,Unknown / Non-Applicable,-1,0,0,44,96,70.0,Q2 Solutions,NY,6,0,0,0,1,0,0,0,0,0,0,0,0,0,0,0,0,other scientist,na,na
698,Revenue Analytics Manager,$45K-$78K (Glassdoor est.),HOVER uses patented technology making it possible for anyone with a smartphone camera to create an i...,4.8,HOVER 4.8,San Francisco- CA,San Francisco- CA,51 - 200,2011,Company - Private,Computer Hardware & Software,Information Technology,$25 to $50 million (USD),-1,0,0,45,78,61.5,HOVER,CA,10,0,0,0,1,1,0,0,0,0,0,0,1,0,0,0,0,Data scientist project manager,na,na
699,Sr. Scientist Method Development,$50K-$110K (Glassdoor est.),Q2 Solutions is a leading clinical trial laboratory services organization with end-to-end laboratory...,2.9,Q2 Solutions 2.9,Marietta- GA,Morrisville- NC,1001 - 5000,2015,Company - Private,Biotech & Pharmaceuticals,Biotech & Pharmaceuticals,Unknown / Non-Applicable,-1,0,0,50,110,80.0,Q2 Solutions,GA,6,0,0,0,1,0,0,0,0,0,0,0,0,0,0,0,0,other scientist,sr,na
700,Data Scientist,$60K-$99K (Glassdoor est.),Job Description Oversight is a leading provider of cloud-based artificial intelligence solutions a...,4.7,Oversight Systems 4.7,Atlanta- GA,Atlanta- GA,51 - 200,2003,Company - Private,Computer Hardware & Software,Information Technology,$25 to $50 million (USD),-1,0,0,60,99,79.5,Oversight Systems,GA,18,1,0,0,1,1,0,1,1,1,0,0,0,0,0,0,0,data scientist,na,na
701,Data Scientist - Sales,$130K-$206K (Glassdoor est.),"Dubbed an ""open-source unicorn"" by Forbes- Confluent is the fastest-growing enterprise subscription ...",4.7,Confluent 4.7,Mountain View- CA,Mountain View- CA,501 - 1000,2014,Company - Private,Computer Hardware & Software,Information Technology,$100 to $500 million (USD),-1,0,0,130,206,168.0,Confluent,CA,7,1,0,0,1,1,0,0,0,0,0,0,1,0,0,0,0,data scientist,na,na
702,IT - Data Engineer II,$61K-$119K (Glassdoor est.),IT - Data Engineer II The Data Engineer II provides support development in the field of big data an...,3.4,Arbella Insurance 3.4,Quincy- MA,Quincy- MA,1001 - 5000,1988,Company - Private,Insurance Carriers,Insurance,$100 to $500 million (USD),-1,0,0,61,119,90.0,Arbella Insurance,MA,33,0,1,0,1,1,0,0,0,0,0,1,0,0,0,0,0,data engineer,na,na
703,Research Scientist- Immunology - Cancer Biology,Employer Provided Salary:$100K-$140K,Research Scientist- Immunology - Cancer Biology Location: Cambridge- MA Kronos Bio seeks a highly mo...,-1.0,Kronos Bio,Cambridge- MA,San Mateo- CA,unknown,-1,Company - Private,-1,-1,Unknown / Non-Applicable,-1,0,1,100,140,120.0,Kronos Bi,MA,-1,0,0,0,1,0,0,0,0,0,0,0,0,0,0,0,0,other scientist,na,P
704,Senior Data Analyst,$99K-$178K (Glassdoor est.),Senior Data Analyst About us Life360 brings families closer with smart tools designed to protect ...,3.9,Life360 3.9,San Francisco- CA,San Francisco- CA,51 - 200,2008,Company - Public,Computer Hardware & Software,Information Technology,Unknown / Non-Applicable,-1,0,0,99,178,138.5,Life360,CA,13,1,0,0,0,1,0,0,0,0,0,0,1,0,0,0,0,analyst,sr,na
705,Principal- Data Science - Advanced Analytics,$86K-$137K (Glassdoor est.),IQVIA is the leading human data science company focused on helping healthcare clients find unparalle...,3.6,IQVIA 3.6,Plymouth Meeting- PA,Durham- NC,10000+,2017,Company - Public,Biotech & Pharmaceuticals,Biotech & Pharmaceuticals,$2 to $5 billion (USD),PPD- INC Research- PRA Health Sciences,0,0,86,137,111.5,IQVIA,PA,4,0,0,0,0,0,0,0,0,0,0,0,0,0,0,0,0,data scientist,sr,M
706,Data Science Project Manager,$37K-$100K (Glassdoor est.),At MassMutual- we are passionate about helping millions of people find financial freedom and this pa...,3.6,MassMutual 3.6,Boston- MA,Springfield- MA,5001 - 10000,1851,Company - Private,Insurance Carriers,Insurance,$10+ billion (USD),-1,0,0,37,100,68.5,MassMutual,MA,170,0,0,0,1,0,0,0,0,0,0,0,0,0,0,0,0,data scientist,na,M
707,Sr Scientist- Immuno-Oncology - Oncology,$58K-$111K (Glassdoor est.),Site Name: USA - Massachusetts - Cambridge Posted Date: Mar 24 2020 Are you energized by a challeng...,3.9,GSK 3.9,Cambridge- MA,Brentford- United Kingdom,10000+,1830,Company - Public,Biotech & Pharmaceuticals,Biotech & Pharmaceuticals,$10+ billion (USD),Pfizer- AstraZeneca- Merck,0,0,58,111,84.5,GSK,MA,191,0,0,1,0,0,0,0,0,0,0,0,0,0,0,0,0,other scientist,sr,M
708,Senior Data Engineer,$72K-$133K (Glassdoor est.),THE CHALLENGE Eventbrite has a world-class data repository of live events- powering millions of even...,4.4,Eventbrite 4.4,Nashville- TN,San Francisco- CA,1001 - 5000,2006,Company - Public,Internet,Information Technology,$100 to $500 million (USD),See Tickets- TicketWeb- Vendini,0,0,72,133,102.5,Eventbrite,TN,15,1,1,1,0,1,0,0,0,0,0,1,0,0,0,0,0,data engineer,sr,na
709,Project Scientist - Auton Lab- Robotics Institute,$56K-$91K (Glassdoor est.),The Auton Lab at Carnegie Mellon University is a large academic group driven by a desire to make a r...,2.6,Software Engineering Institute 2.6,Pittsburgh- PA,Pittsburgh- PA,501 - 1000,1984,College / University,Colleges & Universities,Education,Unknown / Non-Applicable,-1,0,0,56,91,73.5,Software Engineering Institute,PA,37,0,0,0,1,0,0,0,0,0,0,0,0,0,0,0,0,other scientist,na,P
711,Research Scientist – Security and Privacy,$61K-$126K (Glassdoor est.),Returning Candidate? Log back in to the Career Portal and click on 'Job Browsing/History' and find t...,3.6,Riverside Research Institute 3.6,Beavercreek- OH,Arlington- VA,501 - 1000,1967,Nonprofit Organization,Federal Agencies,Government,$50 to $100 million (USD),-1,0,0,61,126,93.5,Riverside Research Institute,OH,54,1,0,0,0,0,0,0,0,0,0,0,0,0,0,0,0,other scientist,na,M
712,Data Science Manager,$95K-$160K (Glassdoor est.),Data Science ManagerResponsibilities: Oversee a team of Data Scientists and Data Visualization Anal...,3.2,Numeric- LLC 3.2,Allentown- PA,Chadds Ford- PA,1 - 50,-1,Company - Private,Staffing & Outsourcing,Business Services,$5 to $10 million (USD),-1,0,0,95,160,127.5,Numeric- LLC,PA,-1,0,0,0,1,0,0,0,0,0,0,0,0,0,0,0,0,data scientist,na,na
714,Data Analyst 2 (Missionary Department),$53K-$91K (Glassdoor est.),Purposes Provide department leadership with reliable data from trusted source systems that will emp...,4.2,The Church of Jesus Christ of Latter-day Saints 4.2,Salt Lake City- UT,Salt Lake City- UT,10000+,-1,Nonprofit Organization,Religious Organizations,Non-Profit,Unknown / Non-Applicable,-1,0,0,53,91,72.0,The Church of Jesus Christ of Latter-day Saints,UT,-1,0,0,0,0,1,0,0,0,0,0,0,1,0,0,0,0,analyst,na,na
715,Enterprise Architect- Data,$101K-$158K (Glassdoor est.),The MassMutual Data Science team in the Enterprise Technology and Experience organization is seeking...,3.6,MassMutual 3.6,Boston- MA,Springfield- MA,5001 - 10000,1851,Company - Private,Insurance Carriers,Insurance,$10+ billion (USD),-1,0,0,101,158,129.5,MassMutual,MA,170,1,1,1,1,1,0,0,0,0,0,1,1,1,0,0,0,na,na,na
718,Supply Chain Data Analyst,$33K-$61K (Glassdoor est.),SUMMARY The Supply Chain Data Analyst analyzes Icon’s logistical data and provides reporting tools ...,3.1,Icon Health and Fitness 3.1,Logan- UT,Logan- UT,1001 - 5000,1977,Company - Private,Consumer Products Manufacturing,Manufacturing,$500 million to $1 billion (USD),Life Fitness- Brooks Running- Under Armour,0,0,33,61,47.0,Icon Health and Fitness,UT,44,1,0,0,1,1,0,0,0,0,0,0,1,0,0,0,0,analyst,na,na
719,Data Engineer - ETL,$44K-$86K (Glassdoor est.),Job Description Shipt is a membership-based marketplace that helps people get the things they need....,3.8,Shipt 3.8,Birmingham- AL,Birmingham- AL,501 - 1000,2014,Subsidiary or Business Segment,Consumer Product Rental,Consumer Services,Unknown / Non-Applicable,-1,0,0,44,86,65.0,Shipt,AL,7,1,1,1,1,1,0,0,0,0,0,0,0,0,0,0,0,data engineer,na,na
721,Corporate Risk Data Analyst (SQL Based) - Milwaukee or,$43K-$77K (Glassdoor est.),Job Summary Under supervision and guidance- the Corporate Risk Intelligence Analyst: • Performs data...,3.8,Associated Banc-Corp 3.8,Green Bay- WI,Green Bay- WI,1001 - 5000,1870,Company - Public,Banks & Credit Unions,Finance,$1 to $2 billion (USD),Wells Fargo- BMO Harris Bank- U.S. Bank,0,0,43,77,60.0,Associated Banc-Corp,WI,151,0,0,1,1,0,0,0,0,0,0,0,0,0,0,0,0,analyst,na,na
722,Senior Manager- Epidemiologic Data Scientist,$125K-$210K (Glassdoor est.),ROLE SUMMARY The Senior Manager- Epidemiologic Data Scientist will help our team reimagine and crea...,4.0,Pfizer 4.0,New York- NY,New York- NY,10000+,1849,Company - Public,Biotech & Pharmaceuticals,Biotech & Pharmaceuticals,$10+ billion (USD),-1,0,0,125,210,167.5,Pfizer,NY,172,0,0,1,1,0,0,0,0,0,0,0,0,0,0,0,0,data scientist,sr,M
723,Marketing Data Analyst- May 2020 Undergrad,$44K-$86K (Glassdoor est.),Fareportal is seeking a Marketing Data Analyst t to join our Marketing Team. At Fareportal- we crea...,3.8,Fareportal 3.8,New York- NY,New York- NY,1001 - 5000,2002,Company - Private,Travel Agencies,Travel & Tourism,$2 to $5 billion (USD),Expedia Group- Orbitz Worldwide- Priceline.com,0,0,44,86,65.0,Fareportal,NY,19,0,0,0,1,1,1,0,0,0,0,0,0,0,0,0,0,analyst,na,na
725,Senior Data Analyst,$69K-$119K (Glassdoor est.),Are you passionate about solving challenging problems? Do you thrive being a critical part of an eli...,4.0,Novetta 4.0,Herndon- VA,Mc Lean- VA,501 - 1000,2012,Company - Private,Enterprise Software & Network Solutions,Information Technology,$100 to $500 million (USD),Leidos- CACI International- Booz Allen Hamilton,0,0,69,119,94.0,Novetta,VA,9,1,0,0,0,1,0,0,0,0,0,0,0,0,0,0,0,analyst,sr,na
726,Senior Data Analyst,$65K-$110K (Glassdoor est.),Moda Operandi is an e-commerce platform transforming the way people discover and shop for designer f...,1.9,Moda Operandi 1.9,New York- NY,New York- NY,201 - 500,2010,Company - Private,Department- Clothing- & Shoe Stores,Retail,$100 to $500 million (USD),YOOX NET-A-PORTER GROUP- Farfetch- MATCHESFASHION,0,0,65,110,87.5,Moda Operandi,NY,11,1,0,0,1,1,0,0,0,0,0,0,0,0,0,0,1,analyst,sr,na
727,Senior Data Engineer,$67K-$127K (Glassdoor est.),Are you passionate about solving challenging problems? Do you thrive being a critical part of an eli...,4.0,Novetta 4.0,Reston- VA,Mc Lean- VA,501 - 1000,2012,Company - Private,Enterprise Software & Network Solutions,Information Technology,$100 to $500 million (USD),Leidos- CACI International- Booz Allen Hamilton,0,0,67,127,97.0,Novetta,VA,9,1,1,1,0,1,0,0,0,0,0,1,0,0,1,0,0,data engineer,sr,na
728,Senior Data Engineer,$78K-$147K (Glassdoor est.),The Genesys Cloud Analytics platform is the foundation on which decisions are made that directly imp...,4.3,Genesys 4.3,Durham- NC,Daly City- CA,5001 - 10000,1990,Company - Private,Computer Hardware & Software,Information Technology,$1 to $2 billion (USD),Avaya- Five9- Salesforce,0,0,78,147,112.5,Genesys,NC,31,1,1,1,0,0,0,0,0,0,0,1,0,0,1,0,0,data engineer,sr,na
730,Data Modeler (Analytical Systems),$66K-$117K (Glassdoor est.),At MassMutual- were passionate about helping millions of people find financial freedom and this pass...,3.6,MassMutual 3.6,Boston- MA,Springfield- MA,5001 - 10000,1851,Company - Private,Insurance Carriers,Insurance,$10+ billion (USD),-1,0,0,66,117,91.5,MassMutual,MA,170,0,1,1,1,1,0,0,0,0,0,1,0,0,0,0,0,data modeler,na,na
731,Data Modeler - Data Solutions Engineer,$37K-$66K (Glassdoor est.),Data & Analytics Engineering organization of Liberty Mutual Global Retail Marketing is expanding its...,3.3,Liberty Mutual Insurance 3.3,Indianapolis- IN,Boston- MA,10000+,1912,Company - Private,Insurance Carriers,Insurance,$10+ billion (USD),Travelers- Allstate- State Farm,0,0,37,66,51.5,Liberty Mutual Insurance,IN,109,1,0,0,1,1,0,0,0,0,0,0,0,1,0,0,0,data modeler,na,M
732,Data Scientist in Translational Medicine,$86K-$143K (Glassdoor est.),"29-Jan-2020 Job ID 287818BR {""QuestionName"":""Job Description""-""AnswerValue"":""20 petabytes of data! ...",3.8,Novartis 3.8,Cambridge- MA,Basel- Switzerland,10000+,1996,Company - Public,Biotech & Pharmaceuticals,Biotech & Pharmaceuticals,$10+ billion (USD),-1,0,0,86,143,114.5,Novartis,MA,25,0,0,0,0,0,0,0,0,0,0,0,0,0,0,0,0,data scientist,na,na
733,Data Scientist,$84K-$146K (Glassdoor est.),USEReady is looking for 2-3 Data Scientist to join our Team: Predictive models in R or Python Large ...,4.3,USEReady 4.3,New York- NY,New York- NY,201 - 500,2011,Company - Private,Consulting,Business Services,$10 to $25 million (USD),-1,0,0,84,146,115.0,USEReady,NY,10,1,1,1,0,1,0,0,0,0,0,1,1,0,0,0,0,data scientist,na,na
734,Product Manager/Data Evangelist,$50K-$98K (Glassdoor est.),Product Manager/Data EvangelistSUMMARY Manage business relationships with syndication partners and ...,3.2,Numeric- LLC 3.2,Phila- PA,Chadds Ford- PA,1 - 50,-1,Company - Private,Staffing & Outsourcing,Business Services,$5 to $10 million (USD),-1,0,0,50,98,74.0,Numeric- LLC,PA,-1,1,0,1,0,1,0,0,0,0,0,0,0,0,0,0,0,Data scientist project manager,na,M
735,Associate Environmental Scientist - Wildlife Biologist,$38K-$64K (Glassdoor est.),QK- Inc.- formerly Quad Knopf- has served a diverse client base throughout the Central Valley for ov...,4.7,QK 4.7,Clovis- CA,Visalia- CA,51 - 200,1972,Company - Private,Architectural & Engineering Services,Business Services,$10 to $25 million (USD),-1,0,0,38,64,51.0,QK,CA,49,0,0,0,1,0,0,0,0,0,0,0,0,0,0,0,0,other scientist,na,na
736,Sr Data Engineer (Sr BI Developer),$90K-$110K(Employer est.),Description/Responsibilities Responsible for the ongoing support of existing Data management solut...,3.4,Tivity Health 3.4,Chandler- AZ,Franklin- TN,501 - 1000,1981,Company - Public,Health Care Services & Hospitals,Health Care,Unknown / Non-Applicable,-1,0,0,90,110,100.0,Tivity Health,AZ,40,0,0,0,0,1,0,0,0,0,0,1,0,0,0,0,0,data engineer,sr,na
737,Senior Data Scientist – Visualization- Novartis AI Innovation Lab,$92K-$150K (Glassdoor est.),"10-Oct-2019 Job ID 279466BR {""QuestionName"":""Job Description""-""AnswerValue"":""Two companies and one ...",3.8,Novartis 3.8,Cambridge- MA,Basel- Switzerland,10000+,1996,Company - Public,Biotech & Pharmaceuticals,Biotech & Pharmaceuticals,$10+ billion (USD),-1,0,0,92,150,121.0,Novartis,MA,25,0,0,0,0,0,0,0,0,0,0,0,0,0,0,0,0,data scientist,sr,na
738,Senior Data Analyst/Scientist,$90K-$153K (Glassdoor est.),The world's largest and fastest-growing companies such as Accenture- Adobe- DocuSign and Salesforce ...,4.5,Demandbase 4.5,San Francisco- CA,San Francisco- CA,201 - 500,2006,Company - Private,Computer Hardware & Software,Information Technology,$100 to $500 million (USD),Engagio- Bombora- Terminus,0,0,90,153,121.5,Demandbase,CA,15,0,0,0,0,1,0,0,0,0,0,0,1,1,0,0,0,analyst,sr,na
740,Associate- Data Science- Internal Audit,$43K-$82K (Glassdoor est.),Associate- Data Science- Internal Audit-2001417 Description [POSITION SUMMARY] The Associate- Data S...,3.1,Santander 3.1,Boston- MA,Madrid- Spain,10000+,1856,Company - Private,Banks & Credit Unions,Finance,$10+ billion (USD),-1,0,0,43,82,62.5,Santander,MA,165,1,0,0,1,1,1,0,0,0,0,0,0,0,0,0,0,data scientist,na,M
741,Scientist – Cancer Discovery- Molecular Assay,Employer Provided Salary:$100K-$135K,Scientist – Cancer Discovery- Molecular Assay Location: Cambridge- MA We are seeking an energetic an...,-1.0,Monte Rosa Therapeutics,Cambridge- MA,-1,unknown,-1,Other Organization,-1,-1,Unknown / Non-Applicable,-1,0,1,100,135,117.5,Monte Rosa Therapeutic,MA,-1,0,0,0,1,0,0,0,0,0,0,0,0,0,0,0,0,other scientist,na,P
742,Senior LiDAR Data Scientist,$93K-$151K (Glassdoor est.),Overview Luminar is an autonomous vehicle sensor and software company with the vision to power eve...,3.9,Luminar Technologies 3.9,Orlando- FL,Orlando- FL,201 - 500,2012,Company - Private,Computer Hardware & Software,Information Technology,Unknown / Non-Applicable,-1,0,0,93,151,122.0,Luminar Technologies,FL,9,1,0,1,0,0,0,0,0,0,0,0,0,0,0,0,0,data scientist,sr,M
743,Data Engineer,$61K-$109K (Glassdoor est.),BRMi Technology is seeking a Data Engineer (CI/CD Subject Matter Expert) for a large client in the N...,4.4,BRMi 4.4,Chantilly- VA,Washington- DC,51 - 200,2004,Company - Private,IT Services,Information Technology,Unknown / Non-Applicable,-1,0,0,61,109,85.0,BRMi,VA,17,1,1,1,0,0,0,0,0,0,0,1,0,0,0,0,0,data engineer,na,na
744,Data Engineer,$42K-$79K (Glassdoor est.),Data Engineer 9920 Scottsdale- 3/27/2019 1:46:38 PM Application Development Contractor - W2 Job De...,3.4,IntraEdge 3.4,Scottsdale- AZ,Chandler- AZ,501 - 1000,2002,Company - Private,IT Services,Information Technology,$50 to $100 million (USD),-1,0,0,42,79,60.5,IntraEdge,AZ,19,1,1,1,0,1,0,0,0,0,0,0,0,0,0,1,0,data engineer,na,na
745,Lead Data Scientist,$139K-$221K (Glassdoor est.),Lead Data Scientist will lead specific client projects and modeling teams to deliver technically exc...,3.9,Zest AI 3.9,Burbank- CA,Burbank- CA,51 - 200,2009,Company - Private,Financial Analytics & Research,Finance,$50 to $100 million (USD),-1,0,0,139,221,180.0,Zest AI,CA,12,1,0,0,1,1,0,0,0,0,0,0,0,0,0,0,0,data scientist,sr,M
746,Technology-Minded- Data Professional Opportunities,$40K-$101K (Glassdoor est.),At VU- we help Veterans buy homes. To make that happen- we have a variety of Technology-Minded- Data...,4.7,Veterans United Home Loans 4.7,Columbia- MO,Columbia- MO,1001 - 5000,2002,Company - Private,Lending,Finance,Unknown / Non-Applicable,-1,0,0,40,101,70.5,Veterans United Home Loans,MO,19,0,1,0,1,1,0,0,0,0,0,1,1,0,0,1,0,na,na,na
747,Big Data Engineer,$84K-$153K (Glassdoor est.),Overview Technology is constantly changing- and our adversaries are digitally “going dark” at a ra...,3.3,Peraton 3.3,Chantilly- VA,Herndon- VA,1001 - 5000,2017,Company - Private,Aerospace & Defense,Aerospace & Defense,$1 to $2 billion (USD),-1,0,0,84,153,118.5,Peraton,VA,4,1,1,0,0,1,0,0,0,0,0,1,0,0,0,0,0,data engineer,na,na
748,Salesforce Analytics Consultant,$52K-$81K (Glassdoor est.),Wave6- an Emtec company- innovates with cutting-edge technologies- like Salesforce.com- to help tran...,3.9,Emtec- Inc. 3.9,Chicago- IL,Jacksonville- FL,501 - 1000,1995,Company - Private,Enterprise Software & Network Solutions,Information Technology,$100 to $500 million (USD),-1,0,0,52,81,66.5,Emtec- Inc.,IL,26,1,0,0,0,1,1,0,0,0,0,0,1,1,0,0,0,data analitics,na,M
749,Managing Data Scientist/ML Engineer,$81K-$134K (Glassdoor est.),Managing Data Scientist/ML Engineer Apply Now Become part of the team We’re looking for a Data Sc...,3.4,PA Consulting 3.4,Boston- MA,London- United Kingdom,1001 - 5000,1943,Company - Private,Consulting,Business Services,$100 to $500 million (USD),McKinsey & Company- Accenture- Deloitte,0,0,81,134,107.5,PA Consulting,MA,78,0,1,0,1,1,0,0,0,0,0,1,1,0,0,1,0,data scientist,na,na
750,Senior Data Engineer,$97K-$180K (Glassdoor est.),Position Overview: From software hacking to hardware hacking- we help secure everything from cryptoc...,4.7,Praetorian 4.7,Austin- TX,Austin- TX,51 - 200,2010,Company - Private,Security Services,Business Services,$10 to $25 million (USD),-1,0,0,97,180,138.5,Praetorian,TX,11,1,1,0,0,1,0,0,0,0,1,0,0,0,0,0,0,data engineer,sr,na
751,Staff Scientist- Upstream PD,$49K-$113K (Glassdoor est.),As a Staff Scientist in Upstream Process Development- the candidate will be accountable for planning...,2.7,Advanced BioScience Laboratories 2.7,Rockville- MD,Rockville- MD,201 - 500,1961,Company - Private,Biotech & Pharmaceuticals,Biotech & Pharmaceuticals,$25 to $50 million (USD),-1,0,0,49,113,81.0,Advanced BioScience Laboratories,MD,60,0,0,0,0,0,0,0,0,0,0,0,0,0,0,0,0,other scientist,na,na
752,Data Engineering Analyst,$44K-$73K (Glassdoor est.),As a Data Engineering Analyst with the Life and Health team at COUNTRY Financial- you will assist wi...,3.8,COUNTRY Financial 3.8,Bloomington- IL,Bloomington- IL,1001 - 5000,1925,Company - Private,Insurance Carriers,Insurance,$2 to $5 billion (USD),Northwestern Mutual- American Family Insurance- MetLife,0,0,44,73,58.5,COUNTRY Financial,IL,96,1,1,0,1,1,0,0,0,0,0,1,0,0,0,0,0,data engineer,na,M
753,Sr. Data Engineer,$75K-$140K (Glassdoor est.),Position Purpose As a Senior Data Engineer on the Echo Global Logistics team- you will contribute t...,3.4,Echo Global Logistics 3.4,Chicago- IL,Chicago- IL,1001 - 5000,2005,Company - Public,Transportation Management,Transportation & Logistics,$2 to $5 billion (USD),C.H. Robinson- Total Quality Logistics- Coyote Logistics,0,0,75,140,107.5,Echo Global Logistics,IL,16,0,0,0,0,1,0,0,0,0,0,0,0,0,0,0,0,data engineer,sr,na
754,Scientist- Pharmacometrics,$84K-$157K (Glassdoor est.),Scientist- Pharmacometrics Location Agios Pharmaceuticals HQ Job Code 1215 # of openings 1 Ap...,3.8,Agios Pharmaceuticals 3.8,Cambridge- MA,Cambridge- MA,501 - 1000,2008,Company - Public,Biotech & Pharmaceuticals,Biotech & Pharmaceuticals,$50 to $100 million (USD),-1,0,0,84,157,120.5,Agios Pharmaceuticals,MA,13,0,0,0,0,0,1,0,0,0,0,0,0,0,0,0,0,other scientist,na,M
755,Manager of Data Science,$40K-$87K (Glassdoor est.),Join the Mobile Future with Tapjoy Data Science is pretty much our business - we drive conversions....,3.9,Tapjoy 3.9,San Francisco- CA,San Francisco- CA,201 - 500,2007,Company - Private,Internet,Information Technology,$10 to $25 million (USD),FLURRY- Chartboost,0,0,40,87,63.5,Tapjoy,CA,14,1,1,0,0,1,0,0,0,1,1,0,0,0,0,0,0,data scientist,na,na
756,Scientist Manufacturing Pharma - Kentucky BioProcessing,$68K-$139K (Glassdoor est.),British American Tobacco Reynolds American Incorporated is positively transforming the tobacco indus...,3.1,Reynolds American 3.1,Owensboro- KY,Winston-Salem- NC,5001 - 10000,1875,Company - Private,Consumer Products Manufacturing,Manufacturing,$10+ billion (USD),-1,0,0,68,139,103.5,Reynolds American,KY,146,0,0,0,0,0,0,0,0,0,0,0,0,0,0,0,0,other scientist,na,na
757,Software Engineer (Data Scientist/Software Engineer) - SISW - MG,$72K-$142K (Glassdoor est.),Software Engineer (Data Scientist/Software Engineer) Job Qualifications: The successful candidate ...,4.1,Mentor Graphics 4.1,Fremont- CA,Wilsonville- OR,5001 - 10000,1981,Company - Public,Computer Hardware & Software,Information Technology,$1 to $2 billion (USD),Cadence Design Systems- Synopsys- Altium Limited,0,0,72,142,107.0,Mentor Graphics,CA,40,1,0,0,1,0,0,1,0,0,1,0,0,0,0,0,0,data scientist,na,na
758,Data Engineer,$74K-$137K (Glassdoor est.),Maxar is seeking an independent- creative and driven Data Engineer to help our team by analyzing and...,3.7,Maxar Technologies 3.7,Springfield- VA,Westminster- CO,5001 - 10000,-1,Company - Public,Aerospace & Defense,Aerospace & Defense,$2 to $5 billion (USD),-1,0,0,74,137,105.5,Maxar Technologies,VA,-1,1,1,0,0,1,0,0,0,0,0,1,0,0,0,0,0,data engineer,na,na
759,Data Engineer,$57K-$109K (Glassdoor est.),ICW Group is looking for aData Engineer who will focus on Integration/MDM/Data Warehousing- defining...,2.8,ICW Group 2.8,San Diego- CA,San Diego- CA,501 - 1000,1972,Company - Private,Insurance Carriers,Insurance,$500 million to $1 billion (USD),Liberty Mutual Insurance- EMPLOYERS- Travelers,0,0,57,109,83.0,ICW Group,CA,49,0,0,0,0,1,0,0,0,0,0,0,1,1,0,0,0,data engineer,na,na
