index,Job Title,Salary Estimate,Job Description,Rating,Company Name,Location,Headquarters,Size,Founded,Type of ownership,Industry,Sector,Revenue,Competitors,Hourly,Employer provided,Lower Salary,Upper Salary,Avg Salary(K),company_txt,Job Location,Age,Python,spark,aws,excel,sql,sas,keras,pytorch,scikit,tensor,hadoop,tableau,bi,flink,mongo,google_an,job_title_sim,seniority_by_title,Degree
462,Senior Insurance Data Scientist,$107K-$173K (Glassdoor est.),What We'll Bring: At TransUnion- we have a welcoming and energetic environment that encourages coll...,3.9,TransUnion 3.9,Chicago- IL,Chicago- IL,5001 - 10000,1968,Company - Public,Financial Analytics & Research,Finance,$1 to $2 billion (USD),-1,0,0,107,173,140.0,TransUnion,IL,53,1,0,0,1,1,1,0,0,0,0,0,0,0,0,0,0,data scientist,sr,na
463,Senior Data Science Systems Engineer,$56K-$99K (Glassdoor est.),MITRE’s Army Concepts- Platforms and Theater Operations Department (P622) is seeking a highly motiva...,3.2,MITRE 3.2,Hampton- VA,Bedford- MA,5001 - 10000,1958,Nonprofit Organization,Federal Agencies,Government,$1 to $2 billion (USD),Battelle- General Atomics- SAIC,0,0,56,99,77.5,MITRE,VA,63,0,0,0,0,0,0,0,0,0,0,0,0,0,0,0,0,data scientist,sr,P
464,ENVIRONMENTAL ENGINEER/SCIENTIST,Employer Provided Salary:$25-$28 Per Hour,McPhail Associates- LLC is a geotechnical and geoenvironmental engineering consulting firm located i...,3.3,Mcphail Associates 3.3,Cambridge- MA,Cambridge- MA,1 - 50,1976,Company - Private,Construction,Construction- Repair & Maintenance,Unknown / Non-Applicable,-1,1,1,52,58,55.0,Mcphail Associates,MA,45,0,0,0,1,0,0,0,0,0,0,0,0,0,0,0,0,other scientist,na,na
466,Senior Scientist - Regulatory Submissions,$80K-$155K (Glassdoor est.),British American Tobacco Reynolds American Incorporated is positively transforming the tobacco indus...,3.1,Reynolds American 3.1,Winston-Salem- NC,Winston-Salem- NC,5001 - 10000,1875,Company - Private,Consumer Products Manufacturing,Manufacturing,$10+ billion (USD),-1,0,0,80,155,117.5,Reynolds American,NC,146,0,0,0,1,0,0,0,0,0,0,0,0,0,0,0,0,other scientist,sr,M
467,Scientist - Biomarker and Flow Cytometry,$43K-$98K (Glassdoor est.),Crown Bioscience- a JSR Life Sciences company- is seeking a highly motivated and skilled PhD level s...,2.4,Crown Bioscience 2.4,San Diego- CA,San Diego- CA,501 - 1000,2006,Company - Private,Biotech & Pharmaceuticals,Biotech & Pharmaceuticals,$50 to $100 million (USD),-1,0,0,43,98,70.5,Crown Bioscience,CA,15,0,0,0,0,0,0,0,0,0,0,0,0,0,0,0,0,other scientist,na,M
468,Revenue Analytics Manager,$45K-$78K (Glassdoor est.),HOVER uses patented technology making it possible for anyone with a smartphone camera to create an i...,4.8,HOVER 4.8,San Francisco- CA,San Francisco- CA,51 - 200,2011,Company - Private,Computer Hardware & Software,Information Technology,$25 to $50 million (USD),-1,0,0,45,78,61.5,HOVER,CA,10,0,0,0,1,1,0,0,0,0,0,0,1,0,0,0,0,Data scientist project manager,na,na
469,Associate Scientist- LC/MS Biologics,$44K-$96K (Glassdoor est.),Q2 Solutions is a leading clinical trial laboratory services organization with end-to-end laboratory...,2.9,Q2 Solutions 2.9,Ithaca- NY,Morrisville- NC,1001 - 5000,2015,Company - Private,Biotech & Pharmaceuticals,Biotech & Pharmaceuticals,Unknown / Non-Applicable,-1,0,0,44,96,70.0,Q2 Solutions,NY,6,0,0,0,1,0,0,0,0,0,0,0,0,0,0,0,0,other scientist,na,na
470,Sr. Scientist Method Development,$50K-$110K (Glassdoor est.),Q2 Solutions is a leading clinical trial laboratory services organization with end-to-end laboratory...,2.9,Q2 Solutions 2.9,Marietta- GA,Morrisville- NC,1001 - 5000,2015,Company - Private,Biotech & Pharmaceuticals,Biotech & Pharmaceuticals,Unknown / Non-Applicable,-1,0,0,50,110,80.0,Q2 Solutions,GA,6,0,0,0,1,0,0,0,0,0,0,0,0,0,0,0,0,other scientist,sr,na
471,IT - Data Engineer II,$61K-$119K (Glassdoor est.),IT - Data Engineer II The Data Engineer II provides support development in the field of big data an...,3.4,Arbella Insurance 3.4,Quincy- MA,Quincy- MA,1001 - 5000,1988,Company - Private,Insurance Carriers,Insurance,$100 to $500 million (USD),-1,0,0,61,119,90.0,Arbella Insurance,MA,33,0,1,0,1,1,0,0,0,0,0,1,0,0,0,0,0,data engineer,na,na
472,Research Scientist- Immunology - Cancer Biology,Employer Provided Salary:$100K-$140K,Research Scientist- Immunology - Cancer Biology Location: Cambridge- MA Kronos Bio seeks a highly mo...,-1.0,Kronos Bio,Cambridge- MA,San Mateo- CA,unknown,-1,Company - Private,-1,-1,Unknown / Non-Applicable,-1,0,1,100,140,120.0,Kronos Bi,MA,-1,0,0,0,1,0,0,0,0,0,0,0,0,0,0,0,0,other scientist,na,P
473,Project Scientist - Auton Lab- Robotics Institute,$56K-$91K (Glassdoor est.),The Auton Lab at Carnegie Mellon University is a large academic group driven by a desire to make a r...,2.6,Software Engineering Institute 2.6,Pittsburgh- PA,Pittsburgh- PA,501 - 1000,1984,College / University,Colleges & Universities,Education,Unknown / Non-Applicable,-1,0,0,56,91,73.5,Software Engineering Institute,PA,37,0,0,0,1,0,0,0,0,0,0,0,0,0,0,0,0,other scientist,na,P
476,Data Scientist,$68K-$114K (Glassdoor est.),Overview: Blazing a new trail- we are further developing our Insight Marketing team to include the ...,3.8,Zimmerman Advertising 3.8,Fort Lauderdale- FL,Fort Lauderdale- FL,501 - 1000,1984,Subsidiary or Business Segment,Advertising & Marketing,Business Services,Unknown / Non-Applicable,-1,0,0,68,114,91.0,Zimmerman Advertising,FL,37,1,0,0,1,1,0,0,0,0,0,1,1,0,0,0,0,data scientist,na,na
477,Data Scientist,Employer Provided Salary:$150K-$160K,BPA Services- LLC is seeking a Computer/Data Scientist who will support our customer with insights g...,5.0,BPA Services 5.0,Washington- DC,Alexandria- VA,unknown,-1,Company - Private,Enterprise Software & Network Solutions,Information Technology,Unknown / Non-Applicable,-1,0,1,150,160,155.0,BPA Services,DC,-1,0,0,1,1,0,0,0,0,0,0,0,0,0,0,0,0,data scientist,na,na
479,Enterprise Architect- Data,$101K-$158K (Glassdoor est.),The MassMutual Data Science team in the Enterprise Technology and Experience organization is seeking...,3.6,MassMutual 3.6,Boston- MA,Springfield- MA,5001 - 10000,1851,Company - Private,Insurance Carriers,Insurance,$10+ billion (USD),-1,0,0,101,158,129.5,MassMutual,MA,170,1,1,1,1,1,0,0,0,0,0,1,1,1,0,0,0,na,na,na
482,Senior Manager- Epidemiologic Data Scientist,$125K-$210K (Glassdoor est.),ROLE SUMMARY The Senior Manager- Epidemiologic Data Scientist will help our team reimagine and crea...,4.0,Pfizer 4.0,New York- NY,New York- NY,10000+,1849,Company - Public,Biotech & Pharmaceuticals,Biotech & Pharmaceuticals,$10+ billion (USD),-1,0,0,125,210,167.5,Pfizer,NY,172,0,0,1,1,0,0,0,0,0,0,0,0,0,0,0,0,data scientist,sr,M
483,Corporate Risk Data Analyst (SQL Based) - Milwaukee or,$43K-$77K (Glassdoor est.),Job Summary Under supervision and guidance- the Corporate Risk Intelligence Analyst: • Performs data...,3.8,Associated Banc-Corp 3.8,Green Bay- WI,Green Bay- WI,1001 - 5000,1870,Company - Public,Banks & Credit Unions,Finance,$1 to $2 billion (USD),Wells Fargo- BMO Harris Bank- U.S. Bank,0,0,43,77,60.0,Associated Banc-Corp,WI,151,0,0,1,1,0,0,0,0,0,0,0,0,0,0,0,0,analyst,na,na
485,Lead Data Scientist,$139K-$221K (Glassdoor est.),Lead Data Scientist will lead specific client projects and modeling teams to deliver technically exc...,3.9,Zest AI 3.9,Burbank- CA,Burbank- CA,51 - 200,2009,Company - Private,Financial Analytics & Research,Finance,$50 to $100 million (USD),-1,0,0,139,221,180.0,Zest AI,CA,12,1,0,0,1,1,0,0,0,0,0,0,0,0,0,0,0,data scientist,sr,M
486,Marketing Data Analyst- May 2020 Undergrad,$44K-$86K (Glassdoor est.),Fareportal is seeking a Marketing Data Analyst t to join our Marketing Team. At Fareportal- we crea...,3.8,Fareportal 3.8,New York- NY,New York- NY,1001 - 5000,2002,Company - Private,Travel Agencies,Travel & Tourism,$2 to $5 billion (USD),Expedia Group- Orbitz Worldwide- Priceline.com,0,0,44,86,65.0,Fareportal,NY,19,0,0,0,1,1,1,0,0,0,0,0,0,0,0,0,0,analyst,na,na
487,Senior Data Engineer,$78K-$147K (Glassdoor est.),The Genesys Cloud Analytics platform is the foundation on which decisions are made that directly imp...,4.3,Genesys 4.3,Durham- NC,Daly City- CA,5001 - 10000,1990,Company - Private,Computer Hardware & Software,Information Technology,$1 to $2 billion (USD),Avaya- Five9- Salesforce,0,0,78,147,112.5,Genesys,NC,31,1,1,1,0,0,0,0,0,0,0,1,0,0,1,0,0,data engineer,sr,na
488,Senior Data Analyst,$65K-$110K (Glassdoor est.),Moda Operandi is an e-commerce platform transforming the way people discover and shop for designer f...,1.9,Moda Operandi 1.9,New York- NY,New York- NY,201 - 500,2010,Company - Private,Department- Clothing- & Shoe Stores,Retail,$100 to $500 million (USD),YOOX NET-A-PORTER GROUP- Farfetch- MATCHESFASHION,0,0,65,110,87.5,Moda Operandi,NY,11,1,0,0,1,1,0,0,0,0,0,0,0,0,0,0,1,analyst,sr,na
489,Data Modeler - Data Solutions Engineer,$37K-$66K (Glassdoor est.),Data & Analytics Engineering organization of Liberty Mutual Global Retail Marketing is expanding its...,3.3,Liberty Mutual Insurance 3.3,Indianapolis- IN,Boston- MA,10000+,1912,Company - Private,Insurance Carriers,Insurance,$10+ billion (USD),Travelers- Allstate- State Farm,0,0,37,66,51.5,Liberty Mutual Insurance,IN,109,1,0,0,1,1,0,0,0,0,0,0,0,1,0,0,0,data modeler,na,M
490,Associate Environmental Scientist - Wildlife Biologist,$38K-$64K (Glassdoor est.),QK- Inc.- formerly Quad Knopf- has served a diverse client base throughout the Central Valley for ov...,4.7,QK 4.7,Clovis- CA,Visalia- CA,51 - 200,1972,Company - Private,Architectural & Engineering Services,Business Services,$10 to $25 million (USD),-1,0,0,38,64,51.0,QK,CA,49,0,0,0,1,0,0,0,0,0,0,0,0,0,0,0,0,other scientist,na,na
491,Associate- Data Science- Internal Audit,$43K-$82K (Glassdoor est.),Associate- Data Science- Internal Audit-2001417 Description [POSITION SUMMARY] The Associate- Data S...,3.1,Santander 3.1,Boston- MA,Madrid- Spain,10000+,1856,Company - Private,Banks & Credit Unions,Finance,$10+ billion (USD),-1,0,0,43,82,62.5,Santander,MA,165,1,0,0,1,1,1,0,0,0,0,0,0,0,0,0,0,data scientist,na,M
492,Sr Data Engineer (Sr BI Developer),$90K-$110K(Employer est.),Description/Responsibilities Responsible for the ongoing support of existing Data management solut...,3.4,Tivity Health 3.4,Chandler- AZ,Franklin- TN,501 - 1000,1981,Company - Public,Health Care Services & Hospitals,Health Care,Unknown / Non-Applicable,-1,0,0,90,110,100.0,Tivity Health,AZ,40,0,0,0,0,1,0,0,0,0,0,1,0,0,0,0,0,data engineer,sr,na
493,Data Engineer,$61K-$109K (Glassdoor est.),BRMi Technology is seeking a Data Engineer (CI/CD Subject Matter Expert) for a large client in the N...,4.4,BRMi 4.4,Chantilly- VA,Washington- DC,51 - 200,2004,Company - Private,IT Services,Information Technology,Unknown / Non-Applicable,-1,0,0,61,109,85.0,BRMi,VA,17,1,1,1,0,0,0,0,0,0,0,1,0,0,0,0,0,data engineer,na,na
494,Senior LiDAR Data Scientist,$93K-$151K (Glassdoor est.),Overview Luminar is an autonomous vehicle sensor and software company with the vision to power eve...,3.9,Luminar Technologies 3.9,Orlando- FL,Orlando- FL,201 - 500,2012,Company - Private,Computer Hardware & Software,Information Technology,Unknown / Non-Applicable,-1,0,0,93,151,122.0,Luminar Technologies,FL,9,1,0,1,0,0,0,0,0,0,0,0,0,0,0,0,0,data scientist,sr,M
495,Salesforce Analytics Consultant,$52K-$81K (Glassdoor est.),Wave6- an Emtec company- innovates with cutting-edge technologies- like Salesforce.com- to help tran...,3.9,Emtec- Inc. 3.9,Chicago- IL,Jacksonville- FL,501 - 1000,1995,Company - Private,Enterprise Software & Network Solutions,Information Technology,$100 to $500 million (USD),-1,0,0,52,81,66.5,Emtec- Inc.,IL,26,1,0,0,0,1,1,0,0,0,0,0,1,1,0,0,0,data analitics,na,M
496,Technology-Minded- Data Professional Opportunities,$40K-$101K (Glassdoor est.),At VU- we help Veterans buy homes. To make that happen- we have a variety of Technology-Minded- Data...,4.7,Veterans United Home Loans 4.7,Columbia- MO,Columbia- MO,1001 - 5000,2002,Company - Private,Lending,Finance,Unknown / Non-Applicable,-1,0,0,40,101,70.5,Veterans United Home Loans,MO,19,0,1,0,1,1,0,0,0,0,0,1,1,0,0,1,0,na,na,na
497,Senior Data Engineer,$97K-$180K (Glassdoor est.),Position Overview: From software hacking to hardware hacking- we help secure everything from cryptoc...,4.7,Praetorian 4.7,Austin- TX,Austin- TX,51 - 200,2010,Company - Private,Security Services,Business Services,$10 to $25 million (USD),-1,0,0,97,180,138.5,Praetorian,TX,11,1,1,0,0,1,0,0,0,0,1,0,0,0,0,0,0,data engineer,sr,na
498,Managing Data Scientist/ML Engineer,$81K-$134K (Glassdoor est.),Managing Data Scientist/ML Engineer Apply Now Become part of the team We’re looking for a Data Sc...,3.4,PA Consulting 3.4,Boston- MA,London- United Kingdom,1001 - 5000,1943,Company - Private,Consulting,Business Services,$100 to $500 million (USD),McKinsey & Company- Accenture- Deloitte,0,0,81,134,107.5,PA Consulting,MA,78,0,1,0,1,1,0,0,0,0,0,1,1,0,0,1,0,data scientist,na,na
499,Scientist- Pharmacometrics,$84K-$157K (Glassdoor est.),Scientist- Pharmacometrics Location Agios Pharmaceuticals HQ Job Code 1215 # of openings 1 Ap...,3.8,Agios Pharmaceuticals 3.8,Cambridge- MA,Cambridge- MA,501 - 1000,2008,Company - Public,Biotech & Pharmaceuticals,Biotech & Pharmaceuticals,$50 to $100 million (USD),-1,0,0,84,157,120.5,Agios Pharmaceuticals,MA,13,0,0,0,0,0,1,0,0,0,0,0,0,0,0,0,0,other scientist,na,M
500,Staff Scientist- Upstream PD,$49K-$113K (Glassdoor est.),As a Staff Scientist in Upstream Process Development- the candidate will be accountable for planning...,2.7,Advanced BioScience Laboratories 2.7,Rockville- MD,Rockville- MD,201 - 500,1961,Company - Private,Biotech & Pharmaceuticals,Biotech & Pharmaceuticals,$25 to $50 million (USD),-1,0,0,49,113,81.0,Advanced BioScience Laboratories,MD,60,0,0,0,0,0,0,0,0,0,0,0,0,0,0,0,0,other scientist,na,na
501,Scientist Manufacturing Pharma - Kentucky BioProcessing,$68K-$139K (Glassdoor est.),British American Tobacco Reynolds American Incorporated is positively transforming the tobacco indus...,3.1,Reynolds American 3.1,Owensboro- KY,Winston-Salem- NC,5001 - 10000,1875,Company - Private,Consumer Products Manufacturing,Manufacturing,$10+ billion (USD),-1,0,0,68,139,103.5,Reynolds American,KY,146,0,0,0,0,0,0,0,0,0,0,0,0,0,0,0,0,other scientist,na,na
502,Sr. Data Engineer,$75K-$140K (Glassdoor est.),Position Purpose As a Senior Data Engineer on the Echo Global Logistics team- you will contribute t...,3.4,Echo Global Logistics 3.4,Chicago- IL,Chicago- IL,1001 - 5000,2005,Company - Public,Transportation Management,Transportation & Logistics,$2 to $5 billion (USD),C.H. Robinson- Total Quality Logistics- Coyote Logistics,0,0,75,140,107.5,Echo Global Logistics,IL,16,0,0,0,0,1,0,0,0,0,0,0,0,0,0,0,0,data engineer,sr,na
505,Lead Big Data Engineer,$121K-$203K (Glassdoor est.),Our mission is to help people everywhere find a job and company they love. We are disrupting an indu...,4.0,Glassdoor 4.0,San Francisco- CA,Mill Valley- CA,1001 - 5000,2007,Company - Private,Internet,Information Technology,Unknown / Non-Applicable,Indeed- LinkedIn,0,0,121,203,162.0,Glassdoor,CA,14,1,1,1,1,0,0,0,0,0,0,1,0,0,0,0,0,data engineer,sr,na
506,Product Engineer – Spatial Data Science and Statistical Analysis,$52K-$85K (Glassdoor est.),Overview Do you have a passion for finding underlying patterns and helping people make data-driven...,3.5,Esri 3.5,Redlands- CA,Redlands- CA,1001 - 5000,1969,Company - Private,Computer Hardware & Software,Information Technology,$1 to $2 billion (USD),Pitney Bowes,0,0,52,85,68.5,Esri,CA,52,1,1,0,1,0,0,0,1,1,1,0,0,0,0,0,0,data scientist,na,M
507,Sr Software Engineer (Data Scientist),$81K-$140K (Glassdoor est.),Assurant Labs is looking for a thoughtful- adaptive individual with a growth mindset to join our gro...,3.4,Assurant 3.4,Westlake- OH,New York- NY,10000+,1978,Company - Public,Insurance Carriers,Insurance,$5 to $10 billion (USD),Asurion- SquareTrade- National General Insurance,0,0,81,140,110.5,Assurant,OH,43,0,0,0,1,1,0,0,1,0,1,0,0,0,0,0,0,data scientist,sr,na
508,College Hire - Data Scientist - Open to December 2019 Graduates,$63K-$99K (Glassdoor est.),Description Caterpillar's legacy of industry leadership dates back to 1925. We have a global footpr...,3.7,Caterpillar 3.7,Peoria- IL,Deerfield- IL,10000+,1925,Company - Public,Industrial Manufacturing,Manufacturing,$10+ billion (USD),John Deere- Komatsu- CNH Industrial,0,0,63,99,81.0,Caterpillar,IL,96,0,0,0,0,0,0,0,0,0,0,0,1,0,0,0,0,data scientist,na,na
509,Senior Data Scientist,$110K-$150K(Employer est.),Working for Equity Residential (EQR)- a leading multi-family real estate investment trust (REIT)- me...,4.3,Equity Residential 4.3,Chicago- IL,Chicago- IL,1001 - 5000,1993,Company - Public,Real Estate,Real Estate,$2 to $5 billion (USD),UDR- AvalonBay Communities- Essex Property Trust,0,0,110,150,130.0,Equity Residential,IL,28,1,1,0,1,1,0,0,0,1,0,1,1,1,0,0,0,data scientist,sr,M
510,Sr. Data Engineer (ETL Developer),$83K-$148K (Glassdoor est.),Summary FGL Holdings—the F&G family of insurance companies—is committed to helping Americans prepar...,3.7,F&G 3.7,Des Moines- IA,Des Moines- IA,201 - 500,-1,Subsidiary or Business Segment,Insurance Carriers,Insurance,$100 to $500 million (USD),-1,0,0,83,148,115.5,F&G,IA,-1,1,0,0,1,1,0,0,0,0,0,0,1,0,0,0,0,data engineer,sr,na
512,Senior Data Scientist Artificial Intelligence,$60K-$101K (Glassdoor est.),*Organization and Job ID** Job ID: 310481 Directorate: National Security Directorate Division: Com...,3.8,PNNL 3.8,Richland- WA,Richland- WA,1001 - 5000,1965,Government,Energy,Oil- Gas- Energy & Utilities,$500 million to $1 billion (USD),Oak Ridge National Laboratory- National Renewable Energy Lab- Los Alamos National Laboratory,0,0,60,101,80.5,PNNL,WA,56,0,0,0,0,0,0,0,1,0,1,0,0,0,0,0,0,data scientist,sr,M
516,Analytics - Business Assurance Data Analyst,$31K-$55K (Glassdoor est.),Analytics - Business Assurance Data Analyst (Cedar Rapids- IA) Position Summary GreatAmerica is a n...,4.6,GreatAmerica Financial Services 4.6,Cedar Rapids- IA,Cedar Rapids- IA,501 - 1000,1992,Company - Private,Lending,Finance,$100 to $500 million (USD),-1,0,0,31,55,43.0,GreatAmerica Financial Services,IA,29,0,0,0,1,1,0,0,0,0,0,0,1,0,0,0,0,analyst,na,na
517,Associate Director/Director- Safety Scientist,$102K-$178K (Glassdoor est.),Who are we? Acceleron is a biopharmaceutical company dedicated to the discovery- development- and c...,4.4,Acceleron Pharma 4.4,Cambridge- MA,Cambridge- MA,201 - 500,2003,Company - Public,Biotech & Pharmaceuticals,Biotech & Pharmaceuticals,Unknown / Non-Applicable,-1,0,0,102,178,140.0,Acceleron Pharma,MA,18,0,0,0,1,0,0,0,0,0,0,0,0,0,0,0,0,director,na,P
518,Senior Scientist- Cell Pharmacology/Assay Development,Employer Provided Salary:$110K-$130K,Senior Scientist- Cell Pharmacology/Assay Development Location: Cambridge MA Kronos Bio seeks a high...,-1.0,Kronos Bio,Cambridge- MA,San Mateo- CA,unknown,-1,Company - Private,-1,-1,Unknown / Non-Applicable,-1,0,1,110,130,120.0,Kronos Bi,MA,-1,0,0,0,0,0,0,0,0,0,0,0,0,0,0,0,0,other scientist,sr,P
519,Data Analyst Senior,$48K-$85K (Glassdoor est.),Data Analyst Senior Location Philadelphia- PA Telecommuter? No ID** 18676 Your career starts...,3.0,AmeriHealth Caritas 3.0,Philadelphia- PA,Philadelphia- PA,5001 - 10000,1983,Company - Private,Insurance Carriers,Insurance,$5 to $10 billion (USD),UnitedHealth Group- Molina Healthcare- Centene,0,0,48,85,66.5,AmeriHealth Caritas,PA,38,0,0,0,1,1,1,0,0,0,0,0,1,0,0,0,0,analyst,sr,M
520,Lead Data Engineer (Python),$66K-$123K (Glassdoor est.),Lead Data Engineer (Python) Strategic Employment San Francisco- CA Are you interested in using you...,4.7,Strategic Employment Partners 4.7,San Francisco- CA,Los Angeles- CA,51 - 200,2006,Company - Private,Staffing & Outsourcing,Business Services,$1 to $5 million (USD),-1,0,0,66,123,94.5,Strategic Employment Partners,CA,15,1,0,1,0,0,0,0,0,0,0,0,0,0,0,0,0,data engineer,sr,na
521,Senior Data Scientist 4 Artificial Intelligence,$92K-$146K (Glassdoor est.),*Organization and Job ID** Job ID: 310468 Directorate: National Security Directorate Division: Com...,3.8,PNNL 3.8,Seattle- WA,Richland- WA,1001 - 5000,1965,Government,Energy,Oil- Gas- Energy & Utilities,$500 million to $1 billion (USD),Oak Ridge National Laboratory- National Renewable Energy Lab- Los Alamos National Laboratory,0,0,92,146,119.0,PNNL,WA,56,0,0,0,0,0,0,0,1,0,1,0,0,0,0,0,0,data scientist,sr,M
522,Medical Lab Scientist - MLT,$21-$29 Per Hour(Glassdoor est.),Position Type: Regular Scheduled Hours per 2 week Pay Period: 80 Primary Location: NE > OMAHA > IMMA...,3.2,Catholic Health Initiatives 3.2,Omaha- NE,Englewood- CO,10000+,1996,Nonprofit Organization,Health Care Services & Hospitals,Health Care,$10+ billion (USD),Dignity Health- Trinity Health,1,0,43,60,51.5,Catholic Health Initiatives,NE,25,0,0,0,0,0,0,0,0,0,0,0,0,0,0,0,0,other scientist,na,na
523,Senior Operations Data Analyst- Call Center Operations,$10-$17 Per Hour(Glassdoor est.),Summary Independent contributor role that uses expert skills in process- strategy- data mining con...,2.7,FLEETCOR 2.7,Nashville- TN,Peachtree Corners- GA,5001 - 10000,2000,Company - Public,Financial Transaction Processing,Finance,$2 to $5 billion (USD),-1,1,0,20,35,27.5,FLEETCOR,TN,21,0,0,0,1,0,0,0,0,0,0,0,1,0,0,0,0,analyst,sr,na
524,Director II- Data Science - GRS Predictive Analytics,$150K-$239K (Glassdoor est.),Advance your career at Liberty Mutual Insurance - A Fortune 100 Company! Job Summary: The GRS Pred...,3.3,Liberty Mutual Insurance 3.3,Chicago- IL,Boston- MA,10000+,1912,Company - Private,Insurance Carriers,Insurance,$10+ billion (USD),Travelers- Allstate- State Farm,0,0,150,239,194.5,Liberty Mutual Insurance,IL,109,1,0,0,0,0,1,0,0,0,0,0,0,0,0,0,0,data scientist,na,P
525,RESEARCH COMPUTER SCIENTIST - RESEARCH ENGINEER - SR. COMPUTER SCIENTIST - SOFTWARE DEVELOPMENT,$52K-$91K (Glassdoor est.),Serve as a software developer and researcher on a team developing software solutions for programs ma...,3.9,Southwest Research Institute 3.9,San Antonio- TX,San Antonio- TX,1001 - 5000,1947,Nonprofit Organization,Research & Development,Business Services,$500 million to $1 billion (USD),Los Alamos National Laboratory- Battelle- SRI International,0,0,52,91,71.5,Southwest Research Institute,TX,74,1,0,1,1,1,0,0,0,0,0,0,0,0,0,0,0,other scientist,sr,na
526,Geospatial Software Developer and Data Scientist,$82K-$129K(Employer est.),Job Posting Title: Geospatial Software Developer and Data Scientist ---- Hiring Department: Appl...,3.7,Applied Research Laboratories 3.7,Austin- TX,Austin- TX,501 - 1000,-1,College / University,Colleges & Universities,Education,Unknown / Non-Applicable,-1,0,0,82,129,105.5,Applied Research Laboratories,TX,-1,1,0,1,0,0,0,1,1,1,1,0,0,0,0,0,0,data scientist,na,na
528,Senior Scientist - Toxicologist - Product Integrity (Stewardship),$47K-$101K (Glassdoor est.),British American Tobacco Reynolds American Incorporated is positively transforming the tobacco indus...,3.1,Reynolds American 3.1,Winston-Salem- NC,Winston-Salem- NC,5001 - 10000,1875,Company - Private,Consumer Products Manufacturing,Manufacturing,$10+ billion (USD),-1,0,0,47,101,74.0,Reynolds American,NC,146,0,0,0,1,0,0,0,0,0,0,0,0,0,0,0,0,other scientist,sr,M
530,Systems Engineer II - Data Analyst,$49K-$76K (Glassdoor est.),­­Missile Systems provides many different high-technology weapon systems solutions to our defense cu...,3.7,Raytheon 3.7,Huntsville- AL,Waltham- MA,10000+,1922,Company - Public,Aerospace & Defense,Aerospace & Defense,$10+ billion (USD),-1,0,0,49,76,62.5,Raytheon,AL,99,0,0,0,1,0,0,0,0,0,0,0,0,0,0,0,0,analyst,na,na
532,Senior Research Analytical Scientist-Non-Targeted Analysis,$43K-$88K (Glassdoor est.),RTI International is seeking a Senior Research Analytical Scientist with experience conducting non-t...,4.3,RTI International 4.3,Durham- NC,Research Triangle Park- NC,1001 - 5000,1958,Nonprofit Organization,Research & Development,Business Services,$500 million to $1 billion (USD),Westat- Abt Associates- Chemonics International,0,0,43,88,65.5,RTI International,NC,63,0,0,0,0,0,0,0,0,0,0,0,0,0,0,0,0,other scientist,sr,P
533,Director Data Science,$124K-$199K (Glassdoor est.),We’re looking for a director to drive our data science and analytics group forward! You’ll be joinin...,3.6,TRANZACT 3.6,Fort Lee- NJ,Fort Lee- NJ,1001 - 5000,1989,Company - Private,Advertising & Marketing,Business Services,Unknown / Non-Applicable,-1,0,0,124,199,161.5,TRANZACT,NJ,32,1,0,1,1,1,0,0,0,0,0,0,1,1,0,0,0,data scientist,na,na
534,Sr Data Analyst - IT,$52K-$93K (Glassdoor est.),Position Summary The Senior Data Analyst drives pharma client analytics solutions for United BioSour...,2.1,United BioSource 2.1,Blue Bell- PA,Blue Bell- PA,1001 - 5000,2003,Other Organization,Biotech & Pharmaceuticals,Biotech & Pharmaceuticals,$100 to $500 million (USD),Covance- ICON,0,0,52,93,72.5,United BioSource,PA,18,0,0,0,1,1,0,0,0,0,0,0,1,0,0,0,0,analyst,sr,na
535,Senior Data Engineer,$97K-$181K (Glassdoor est.),About Us Figure Eight is the essential Human-in-the-Loop Machine Learning platform for data science...,3.9,Figure Eight 3.9,San Francisco- CA,San Francisco- CA,51 - 200,2008,Company - Public,Computer Hardware & Software,Information Technology,$10 to $25 million (USD),-1,0,0,97,181,139.0,Figure Eight,CA,13,1,0,1,1,0,0,0,0,0,0,0,0,0,0,0,0,data engineer,sr,na
537,Senior Data Engineer,$100K-$173K (Glassdoor est.),Position Title: Senior Data Engineer Position Description / Responsibilities: Tapjoy is seeking a ...,3.9,Tapjoy 3.9,San Francisco- CA,San Francisco- CA,201 - 500,2007,Company - Private,Internet,Information Technology,$10 to $25 million (USD),FLURRY- Chartboost,0,0,100,173,136.5,Tapjoy,CA,14,0,0,0,0,1,0,0,0,0,0,0,0,0,0,0,0,data engineer,sr,na
